{
  "log_level": "debug",
  "ssl_key_file": "../certs/server-key.pem",
  "ssl_cert_file": "../certs/server-crt.pem",
  "ssl_ca_file": "../certs/ca-crt.pem",
  "jwt_secret": "replace-this-value-for-your-installation",
  "port": 3200,
  "base_url": "https://lpwanserver:3200",
  "prisma_url": "http://prisma:4466/lpwanserver/dev",
  "redis_url": "redis://redis:6379/1"
}
